<?xml version="1.0" encoding="UTF-8"?>
<schema targetNamespace="http://com.sdk.realm/RealmWillContestConsequencesDefinitionV0.0.0.1" elementFormDefault="qualified" xmlns="http://www.w3.org/2001/XMLSchema" xmlns:tns="http://com.sdk.realm/RealmWillContestConsequencesDefinitionV0.0.0.1">
    <annotation>
    	<documentation>
    		This schema defines the critical hits used in the
    		application.
    	</documentation>
    </annotation>

    <element name="WillContestConsequenceLibrary" type="tns:WillContestConsequenceLibraryType">
    	<annotation>
    		<documentation>
    			This is the root element of the document. It cotains the
    			list of critical hits as well as any other data about
    			those hits.
    		</documentation>
    	</annotation></element>

    <complexType name="WillContestConsequenceLibraryType">
    	<sequence>
    		<element name="WillContestConsequenceCollection" type="tns:WillContestConsequenceCollectionType" minOccurs="1" maxOccurs="1"></element>
    	</sequence>
    </complexType>
    
    <complexType name="WillContestConsequenceCollectionType">
    	<sequence>
    		<element name="WillContestConsequence" type="tns:WillContestConsequenceType" minOccurs="0" maxOccurs="unbounded"></element>
    	</sequence>
    </complexType>
    
    <complexType name="WillContestConsequenceType">
        <annotation>
        	<documentation>
        		This is a definition of the severity of the hit. The
        		severity increases as the letters progress in the
        		alphabet.
        	</documentation>
        </annotation>
        <sequence>
        	<element name="Description" minOccurs="1" maxOccurs="1"
        		type="string">
        		<annotation>
        			<documentation>
        				This is a general description of a group of
        				hits. It describes some rough characteristic
        				that they all share. This is the highest level
        				of grouping for a collection of critical hits.
        			</documentation>
        		</annotation>

        	</element>
        	<element name="PermanentBonus" minOccurs="1" maxOccurs="1"
        		type="int">
        		<annotation>
        			<documentation>
        				This is the severity of the critical hit. As the
        				values increase through the alphabet, the
        				critical hit becomes more severe. This is the
        				secord highest level of goruping of hits.
        			</documentation>
        		</annotation>

        	</element>
        	<element name="RollValues" type="tns:DiceRollRangeType"
        		minOccurs="1" maxOccurs="1">
        		<annotation>
        			<documentation>
        				Defines the values of the rolls that must be
        				rolled for the hit to be selected. Note that
        				these values are unique within a type and
        				severity combination.
        			</documentation>
        		</annotation>
        	</element>
        	<element name="TemporaryBonus" type="int" minOccurs="1"
        		maxOccurs="1">
        		<annotation>
        			<documentation>
        				Textual descriptio of the critical hit. Inclues
        				some words describing the hit itself as well as
        				consequences of the hit to the victim. This is
        				free form text.
        			</documentation>
        		</annotation>
        	</element>
        	<element name="DurationInRoundsOfTemporaryBounus" type="int" minOccurs="0" maxOccurs="1"></element>
        </sequence>
    </complexType>

    <complexType name="DiceRollRangeType">
    	<annotation>
    		<documentation>
    			I am a range of numbers on a dice roll.
    		</documentation>
    	</annotation>
    	<sequence>
    		<element name="Minimum" type="int" minOccurs="1"
    			maxOccurs="1">
    			<annotation>
    				<documentation>
    					This is the minimum roll required to be within
    					my range. This is an inclusive value i.e. if the
    					minimum value is 35 and a roll is 35 it falls
    					inside this range.
    				</documentation>
    			</annotation>
    		</element>
    		<element name="Maximum" type="int" minOccurs="1" maxOccurs="1">
    			<annotation>
    				<documentation>
    					This is the maximum roll required to be within
    					my range. This is an inclusive value i.e. if the
    					maximum value is 56and a roll is 56it falls
    					inside this range.
    				</documentation>
    			</annotation></element>
    	</sequence>
    </complexType>
</schema>